{
  "as_of": "2026-05-04T11:17:43+05:30",
  "state": "Tamil Nadu",
  "code": "S22",
  "constituencies": [
    {
      "ac_no": 1,
      "name": "Gummidipoondi",
      "leading_candidate": "R. Rajendran",
      "leading_party": "DMK",
      "leading_margin": 5824,
      "rounds_completed": 11,
      "rounds_total": 18,
      "status": "leading",
      "winner": null,
      "winner_party": null,
      "final_margin": null,
      "last_change_ts": "2026-05-04T10:52:11+05:30"
    },
    {
      "ac_no": 2,
      "name": "Ponneri",
      "leading_candidate": "K. Arulmozhivarman",
      "leading_party": "DMK",
      "leading_margin": 8143,
      "rounds_completed": 14,
      "rounds_total": 18,
      "status": "leading",
      "winner": null,
      "winner_party": null,
      "final_margin": null,
      "last_change_ts": "2026-05-04T11:03:28+05:30"
    },
    {
      "ac_no": 3,
      "name": "Tiruttani",
      "leading_candidate": "P. Senthilkumar",
      "leading_party": "AIADMK",
      "leading_margin": 1247,
      "rounds_completed": 8,
      "rounds_total": 20,
      "status": "leading",
      "winner": null,
      "winner_party": null,
      "final_margin": null,
      "last_change_ts": "2026-05-04T10:44:55+05:30"
    },
    {
      "ac_no": 4,
      "name": "Sholinghur",
      "leading_candidate": "M. Vijayakumar",
      "leading_party": "DMK",
      "leading_margin": 3902,
      "rounds_completed": 10,
      "rounds_total": 17,
      "status": "leading",
      "winner": null,
      "winner_party": null,
      "final_margin": null,
      "last_change_ts": "2026-05-04T11:09:03+05:30"
    },
    {
      "ac_no": 5,
      "name": "Katpadi",
      "leading_candidate": "S. Anbalagan",
      "leading_party": "AIADMK",
      "leading_margin": 2187,
      "rounds_completed": 9,
      "rounds_total": 17,
      "status": "leading",
      "winner": null,
      "winner_party": null,
      "final_margin": null,
      "last_change_ts": "2026-05-04T10:58:19+05:30"
    },
    {
      "ac_no": 6,
      "name": "Ranipet",
      "leading_candidate": "T. Dhanasekaran",
      "leading_party": "DMK",
      "leading_margin": 4611,
      "rounds_completed": 12,
      "rounds_total": 18,
      "status": "leading",
      "winner": null,
      "winner_party": null,
      "final_margin": null,
      "last_change_ts": "2026-05-04T11:01:44+05:30"
    },
    {
      "ac_no": 7,
      "name": "Arcot",
      "leading_candidate": "N. Baskar",
      "leading_party": "DMK",
      "leading_margin": 18234,
      "rounds_completed": 18,
      "rounds_total": 18,
      "status": "declared",
      "winner": "N. Baskar",
      "winner_party": "DMK",
      "final_margin": 18234,
      "last_change_ts": "2026-05-04T10:31:02+05:30"
    },
    {
      "ac_no": 8,
      "name": "Vellore",
      "leading_candidate": "A. Karthikeyan",
      "leading_party": "DMK",
      "leading_margin": 12881,
      "rounds_completed": 16,
      "rounds_total": 20,
      "status": "leading",
      "winner": null,
      "winner_party": null,
      "final_margin": null,
      "last_change_ts": "2026-05-04T11:06:55+05:30"
    },
    {
      "ac_no": 9,
      "name": "Anaikattu",
      "leading_candidate": "C. Moorthy",
      "leading_party": "AIADMK",
      "leading_margin": 3445,
      "rounds_completed": 7,
      "rounds_total": 15,
      "status": "leading",
      "winner": null,
      "winner_party": null,
      "final_margin": null,
      "last_change_ts": "2026-05-04T10:49:37+05:30"
    },
    {
      "ac_no": 10,
      "name": "Kilvaithinankuppam",
      "leading_candidate": "R. Prasanna",
      "leading_party": "DMK",
      "leading_margin": 6732,
      "rounds_completed": 13,
      "rounds_total": 19,
      "status": "leading",
      "winner": null,
      "winner_party": null,
      "final_margin": null,
      "last_change_ts": "2026-05-04T11:13:09+05:30"
    },
    {
      "ac_no": 11,
      "name": "Gudiyatham",
      "leading_candidate": "S. Palanivel",
      "leading_party": "AIADMK",
      "leading_margin": 894,
      "rounds_completed": 6,
      "rounds_total": 16,
      "status": "leading",
      "winner": null,
      "winner_party": null,
      "final_margin": null,
      "last_change_ts": "2026-05-04T10:41:22+05:30"
    },
    {
      "ac_no": 12,
      "name": "Vaniyambadi",
      "leading_candidate": "M. Hussain",
      "leading_party": "INC",
      "leading_margin": 2341,
      "rounds_completed": 10,
      "rounds_total": 18,
      "status": "leading",
      "winner": null,
      "winner_party": null,
      "final_margin": null,
      "last_change_ts": "2026-05-04T10:55:48+05:30"
    },
    {
      "ac_no": 13,
      "name": "Ambur",
      "leading_candidate": "A. Majid",
      "leading_party": "DMK",
      "leading_margin": 7128,
      "rounds_completed": 14,
      "rounds_total": 19,
      "status": "leading",
      "winner": null,
      "winner_party": null,
      "final_margin": null,
      "last_change_ts": "2026-05-04T11:04:51+05:30"
    },
    {
      "ac_no": 14,
      "name": "Jolarpet",
      "leading_candidate": "P. Chandran",
      "leading_party": "DMK",
      "leading_margin": 5219,
      "rounds_completed": 11,
      "rounds_total": 17,
      "status": "leading",
      "winner": null,
      "winner_party": null,
      "final_margin": null,
      "last_change_ts": "2026-05-04T11:02:17+05:30"
    },
    {
      "ac_no": 15,
      "name": "Tirupattur",
      "leading_candidate": "K. Subramanian",
      "leading_party": "AIADMK",
      "leading_margin": 1876,
      "rounds_completed": 9,
      "rounds_total": 18,
      "status": "leading",
      "winner": null,
      "winner_party": null,
      "final_margin": null,
      "last_change_ts": "2026-05-04T10:47:33+05:30"
    }
  ]
}
